{
  "schemaVersion": 1,
  "generatedAt": "2026-10-01T04:16:33.884Z",
  "isDemo": false,
  "jobs": [
    {
      "id": "boss-efd63e913f6ff979",
      "company": "成都振芯科技股份...",
      "companySize": "500-999人",
      "companySizeMin": 500,
      "title": "芯片产品经理",
      "description": "工作职责：1.负责该方向市场、竞品分析，产品定义及产品竞争力的准确把握；2.负责该方向产品立项、规格定义及全生命周期管理；3.行业内市场跟踪及深度参与市场推广策略的制定及新产品推广；4.为公司市场销售及技术支持提供产品培训；5.对内部项目各节点进行管控、风险识别，定期汇报项目进展，保证各环节的顺畅推动。任职资格：1.本科5年及以上相关工作经验，掌握集成电路和通信原理的相关知识；2.对相关领域的方案有较深刻的认识；3.具有一定的电路分析经验和芯片的调试经验；4.具有良好的英语基础，能准确阅读数据手册；5.具有任一方向（视频类、接口类、转换器、时钟类、射频类）芯片产品应用方案设计开发能力及用户应用方案优化设计能力者优先；6.具有较强的沟通能力、应变能力和逻辑思维能力。加分项有以下行业经验：半导体/芯片·电子/硬件开发·通信/网络设备",
      "salary": "25-35K·13薪",
      "salaryMinK": 25,
      "salaryMaxK": 35,
      "city": "成都",
      "sources": [
        {
          "type": "boss",
          "name": "Boss直聘",
          "url": "https://www.zhipin.com/job_detail/b8046cc76b6abb4b1Hd62dy0FlFX.html"
        }
      ],
      "firstSeenAt": "2026-09-30T07:29:29.606Z",
      "lastSeenAt": "2026-09-30T15:19:26.645Z",
      "status": "active"
    },
    {
      "id": "boss-1f15f43501e499a9",
      "company": "版石控股集团有限公司",
      "companySize": "100-499人",
      "companySizeMin": 100,
      "title": "甲方合同-产品经理-五险一金_wb7jt",
      "description": "高级产品经理1. 985/211 院校本科及以上学历，物联网/电子/通信/自动化/计算机等与物联⽹和智能化相关专业，要懂技术（软件技术+硬件技术）。2. 5 年及以上⾼级产品经理/产品线总监/产品研发⾼级项目经理经历（三种经历有满足⼀种即可）。3. 需要至少有一个成功的物联网系统解决方案（软件与硬件相结合）项目经历。能够组织和带领产品团队从概念、计划、研发、验证到上市实现产品商业目标，需要有较强的领导力、目标感和事务推进能力。4. 至少在一家公司连续工作满3年，无频繁的跳槽。薪资范围：20K ~ 25K",
      "salary": "20-25K",
      "salaryMinK": 20,
      "salaryMaxK": 25,
      "city": "成都",
      "sources": [
        {
          "type": "boss",
          "name": "Boss直聘",
          "url": "https://www.zhipin.com/job_detail/4aaf8d1a134257e90nNy2dq8EFtV.html"
        }
      ],
      "firstSeenAt": "2026-09-30T07:29:29.606Z",
      "lastSeenAt": "2026-09-30T15:19:26.645Z",
      "status": "active"
    },
    {
      "id": "boss-ee6d201b80e4378b",
      "company": "百词斩",
      "companySize": "500-999人",
      "companySizeMin": 500,
      "title": "用户端产品经理",
      "description": "岗boss位职责1、负责百词斩及旗下APP 的产品建设与迭代，围绕用户留存、用户体验、单用户价值等核心指标，输出包含⽅向讨论、迭代规划、产品落地等环节的完整产品解决⽅案，并对最终结果负责。2、基于数据、⽤户反馈及产品思考，深度洞察词汇学习场景下的痛点与需求，并将其转化为具体的产品功能与设计。3、跨团队沟通协作，推动需求在业务侧高质量、高效率落地。任职要求1、本科及以上学历，3 年左右 C 端产品经验，有教育类产品经验者优先。2、能独⽴梳理产品逻辑与业务流程，具备较强的逻辑思维和用户需求洞察能力，善于将用户需求转化为产品设计，且有优秀的产品落地执行能力。3、具备强烈的责任心、自驱力及跨团队沟通协调能力。4、有良好的用户同理心与学习能力，能快速吸收行业新知识、新趋势。",
      "salary": "20-30K",
      "salaryMinK": 20,
      "salaryMaxK": 30,
      "city": "成都",
      "sources": [
        {
          "type": "boss",
          "name": "Boss直聘",
          "url": "https://www.zhipin.com/job_detail/bef57518f449fe150nJ63N28E1pQ.html"
        }
      ],
      "firstSeenAt": "2026-09-30T07:29:29.606Z",
      "lastSeenAt": "2026-09-30T15:19:26.645Z",
      "status": "updated"
    },
    {
      "id": "boss-0f4bf415f9fd9769",
      "company": "购商云汇信息技术",
      "companySize": "100-499人",
      "companySizeMin": 100,
      "title": "高级 AI 产品经理",
      "description": "岗位职责1. 负责公司 AI 内容生成产品线的规划与落地，对产品目标和业务结果负责。现阶段重点推进 AI 商品图工作台，后续逐步拓展至营销图、商品详情图、营销⽂案、AI 视频等内容⽣成场景。2. 深⼊了解电商商家在商品上新、商品展示和营销推广等环节的内容⽣产需求，结合用户价值、业务价值和实现成本，判断产品机会并制定产品规划和迭代优先级。3. 独立推进产品全流程工作，包括需求调研、方案设计、PRD 输出、研发协同、测试上线、运营推广和数据复盘，协调研发、设计、运营及业务团队按计划完成交付。4. 负责 AI 能力的产品化设计。能够结合大模型和多模态模型的能力边界，合理运用 Prompt、Workflow、RAG 等技术方案，设计稳定、可控且具备规模化应用条件的产品流程。5. 根据产品发展阶段建立指标体系，持续关注使用率、生成成功率、留存、下载/保存、付费转化、复购及模型成本等数据，结合用户反馈定位问题并推动产品迭代。6. 推进 AI 产品商业化验证，围绕免费权益、增值服务、付费功能和用户分层等方向设计方案，持续验证用户付费意愿和商业价值。7. 关注国内外 AIGC、多模态、AI 生图和 AI 视频领域的技术与产品发展，评估新模型、新能力在实际业务中的应用价值，并推动快速验证和上线。任职要求1. 本科及以上学历，5 年以上互联网产品经验，有高级产品经理、产品负责人或同等岗位经历。2. 有较强的项目负责人意识，至少独立负责过一款完整产品或一项重要业务。能够主导方向判断、产品规划、资源协调和落地交付，并对最终结果负责。3. 具备良好的用户思维和商业判断能力，能够识别真实需求，判断产品优先级，并设计可执行的价值验证方案。有商业化、增长、运营或付费产品经验者优先。4. 具备较强的数据分析能力，能够定义核心指标，设计埋点和转化漏斗，并根据数据与用户反馈推动产品决策。5. 有实际 AI 产品经验，理解 LLM、Prompt、Workflow、RAG、多模态等基本概念，能够判断模型能力边界，并与算法、研发团队高效协作。6. 具备较强的跨团队推动能力，能够协调研发、设计、运营及业务团队，在需求和技术方案存在不确定性的情况下持续推进项目。7. 逻辑清晰，执行力强，结果导向，能够适应 AI 产品快速验证、持续迭代的工作节奏。加分项具备以下一项或多项经验者优先：- 负责过 AI 生图、图片编辑、AI 视频或其他多模态产品，并有实际上线经验；- 有电商平台、商家工具、电商 SaaS、商品上新、营销素材或内容生产相关经验；- 有从 0 到 1 推动 AI 产品上线，并形成真实用户规模、使用数据或商业结果的经验。",
      "salary": "20-25K",
      "salaryMinK": 20,
      "salaryMaxK": 25,
      "city": "成都",
      "sources": [
        {
          "type": "boss",
          "name": "Boss直聘",
          "url": "https://www.zhipin.com/job_detail/645bc162563d16a10nN429S1F1pT.html"
        }
      ],
      "firstSeenAt": "2026-09-30T07:29:29.606Z",
      "lastSeenAt": "2026-09-30T15:19:26.645Z",
      "status": "updated"
    },
    {
      "id": "boss-bd07d4ba8f401ca4",
      "company": "京东家装集团有限公司",
      "companySize": "100-499人",
      "companySizeMin": 100,
      "title": "产品经理【履约调度方向】",
      "description": "【核心职责】作为运营产品经理，负责京东生活家自营装修业务施工交付侧业务流程TOB侧线上化推进，包含产品需求洞察、产品规划以及产品设计；具体如下：1、通过履约交付的产品分析及业务调研，发现业务链路中需要改善的地⽅，设计未来的业务场景以及⽀撑其实现的产品形态； 2、基于业务场景需求，明确未来业务场景具体的操作流程，协同产品经理输出MRD/BRD/PRD⽂档对接开发进行实现； 3、通过数据分析以及用户反馈，得出能够提升产品实际使⽤效果的需求点，迭代产品从而获得更好的结果数据； 4、业务规划与跨域协同，能分子公司、各业务侧、产品技术团队深度合作，对负责领域内的产品工具/页面设计/业务逻辑提供改善方案，推动相关产品功能持续迭代。【任职资格】1、信息技术或相关专业本科及以上学历，有家装、地产、物业、制造业、智慧城市等行业经验优先； 2、5+年的产品运营、产品设计的全链路闭环经验，独立规划设计经验不少于3年；3、主导过2个或以上数量的家装交付、质量管理、设备管理等系统的设计与开发优先； 4、具备一定的技术基础知识，有很强的业务思维和用户思维，总是能够从业务价值和用户视角思考问题，并从目标视角管理项目的全过程； 5、具有较强的逻辑思维能力，系统性思考能力，思路清晰，条理清楚；6、熟练使用Axure、Visio、Powerpoint等原型设计软件。",
      "salary": "20-40K",
      "salaryMinK": 20,
      "salaryMaxK": 40,
      "city": "成都",
      "sources": [
        {
          "type": "boss",
          "name": "Boss直聘",
          "url": "https://www.zhipin.com/job_detail/cf32fc243382201b0nF-0tS4E1ZZ.html"
        }
      ],
      "firstSeenAt": "2026-09-30T07:29:29.606Z",
      "lastSeenAt": "2026-09-30T15:19:26.645Z",
      "status": "active"
    },
    {
      "id": "boss-b9d361faa9c6bf76",
      "company": "易训管理咨询",
      "companySize": "100-499人",
      "companySizeMin": 100,
      "title": "智能调度系统产品经理 / 调度策略产品经理",
      "description": "boss岗位职责业务调研与需求抽象：深入理解业务场景（如即时配送、物流干线、网约车派单、政企网格员调度、客服排班、应急指挥等），调研调度痛点，梳理业务约束条件（时间窗、成本、⼈员技能、设备状态等），将其转化为清晰的调度系统需求。调度策略与算法协同：与运筹优化/算法团队紧密协作，将业务问题转化为数学模型（如VRP车辆路径规划、多⽬标优化、任务分配、排班排程等），设计合理的调度策略，平衡效率、成本与⽤户体验。系统架构与产品设计：负责调度系统的整体产品设计，包括规则引擎、策略配置后台、调度看板、仿真推演系统、异常告警与人工⼲预机制等，实现调度的自动化、可视化与可解释性。全生命周期管理：推动跨团队（研发、算法、数据、运营）协同，跟进调度系统从需求到上线的完整闭环，通过A/B实验、灰度发布等方式验证策略效果。数据驱动与持续迭代：建立调度系统的核心指标体系（如履约率、准时率、空驶率、人效、成本等），通过数据分析发现瓶颈，持续优化调度策略与产品体验。仿真与评估体系：参与搭建或优化仿真环境，对调度策略进行离线评估，降低线上试错成本，提升策略迭代效率。任职要求学历与经验：本科及以上学历，工业工程、运筹学、计算机、数学、管理科学与工程等相关专业优先；3年以上B端策略产品/调度系统产品经验。行业背景：有以下任一领域经验者优先：出行/网约车、外卖/即时配送、物流/供应链、客服排班、政企网格化治理、应急指挥调度、云计算资源调度等。算法理解能力：理解常见调度算法（贪心、动态规划、遗传算法、禁忌搜索、强化学习等）的基本原理与适用边界，能与算法工程师顺畅沟通，不需要手写代码，但需要具备将业务约束转化为数学问题的能力。数据能力：熟练使用SQL，具备较强的数据分析能力，能通过数据验证假设、量化策略效果。逻辑与抽象能力：极强的逻辑思维与系统抽象能力，能在复杂的多约束、多目标场景下找到产品的最优解。跨部门协同：优秀的沟通与项目推进能力，能在业务、算法、研发、运营之间建立高效协作机制。加分项有从0到1搭建智能调度系统或策略平台的经验。有复杂的多目标优化（成本、体验、效率、公平性）产品设计经验。熟悉仿真系统的设计或离散事件仿真（DES）。有政企SaaS、多租户调度系统设计经验，熟悉复杂权限体系与数据隔离。在KDD、WWW、NeurIPS、ICML、INFORMS等顶会/期刊发表过运筹优化或调度相关论文。有ACM/NOI/Kaggle等竞赛获奖经历。",
      "salary": "15-20K·14薪",
      "salaryMinK": 15,
      "salaryMaxK": 20,
      "city": "成都",
      "sources": [
        {
          "type": "boss",
          "name": "Boss直聘",
          "url": "https://www.zhipin.com/job_detail/76c7625ce3f18a470nN_3t-7FFNS.html"
        }
      ],
      "firstSeenAt": "2026-09-30T07:29:29.606Z",
      "lastSeenAt": "2026-09-30T15:19:26.645Z",
      "status": "updated"
    },
    {
      "id": "boss-c0648b94b2685235",
      "company": "多点生活",
      "companySize": "1000-9999人",
      "companySizeMin": 1000,
      "title": "产品经理（AI Agent 平台方向）(A122508)",
      "description": "岗位方向企业级 Agent 构建与治理平台、AI 数字员工、多智能体协作、企业知识与工具（MCP / Skills）平台、Agent 评测与可观测、公司级 AI 专家团与资产生态。岗位定位负责多点⽔滴引擎 AI Agent 平台的产品规划与建设，将⼤模型、Agent、知识、⼯具、Memory、工作流、评测与治理能力，沉淀为可复⽤、可扩展、可运营的平台产品。工作职责1. 负责水滴引擎平台的产品战略、产品架构、路线图和关键里程碑，推动平台从「Agent 工厂」升级为「公司级 AI 专家团」，建设专家 Agent、Skill、MCP 等资产的准入、发现与复用生态，实现规模化发展。2. 负责 AI Agent 产品体系设计，包括任务入口、意图理解、任务规划、执行过程、工具调用、Memory、多 Agent 协作、结果呈现、人工确认、失败重试和审计追踪等关键流程。3. 负责 Agent 构建与管理平台设计，为企业用户提供 Agent 创建、角色配置、Prompt 与 Context 管理、Skills 配置、工具 / MCP 接入、知识库绑定、沙箱执行、凭证授权、版本发布、灰度回滚、运行监控和效果评估等能力。4. 负责 AI 能力的平台化抽象，将模型、Agent、知识库、工具、Memory、工作流、评测和安全治理沉淀为标准产品模块与开放 API，支持内部业务与外部团队快速复用。5. 负责评测、可观测与治理体系：评测用例与上线门禁、推理链路与工具轨迹、Token 成本与异常预警、工作空间隔离、权限、审批与审计，让 Agent 可控、可见、可治理。6. 负责数字员工及飞书、企业微信等渠道的使用侧体验，把复杂的模型与平台能力转化为业务用户能直观理解和掌控的产品。7. 深入零售、供应链、财务、人力等业务，识别可由 AI 替代、增强或自动化的关键环节，推动 AI 从「辅助建议」走向「任务执行」，并建立效果评估与持续进化闭环。8. 持续跟踪 OpenAI、Anthropic、字节、阿里、腾讯等公司在 Agent、AI Native 与企业智能化方向的产品演进，转化为平台判断。任职要求1. 本科及以上学历，计算机、人工智能、软件工程等相关专业优先。2. 5 年以上产品经验，其中至少 2 年 AI、大模型、Agent、智能化平台或企业级产品经验。3. 主导过至少一款 AI 原生产品、Agent 平台、AI 数字员工或企业大模型产品的建设，能清晰说明目标用户、核心场景、产品架构、关键指标及迭代结果。4. 理解大模型的能力与局限，熟悉 Prompt、Context、RAG、知识库、Memory、工具调用 / MCP、工作流、多轮对话、模型评测及多 Agent 协作等基本机制。5. 能够从产品角度设计完整的 Agent 架构，包括任务入口、Agent 能力层、模型层、知识层、工具层、执行层、评估层和治理层。6. 具备较强的平台化抽象能力，能将不同业务场景中的共性需求沉淀为标准模块、配置能力及开放接口。7. 是 Claude Code、Cursor 等 AI 工具的重度使用者，能快速做出原型验证假设。8. 具备良好的数据和结果意识，能建立 AI 产品指标体系，通过任务成功率、回答准确率、采用率、执行效率、成本、复用率等指标评估产品价值。9. 具备优秀的产品设计与表达能力，能独立输出产品战略、路线图、PRD、原型、指标体系与验收标准。10. 具备复杂项目推动能力与商业判断，能在技术可行性、用户体验、业务价值、成本和交付效率之间做出合理取舍。优先考虑1. 有 OpenAI、Anthropic、Google Gemini、Microsoft Copilot、Manus，或 WorkBuddy、千问、豆包、DeepSeek、Kimi、飞书 AI、钉钉 AI 等国内外头部 AI 产品的建设或深度使用经验。2. 做过 Agent 构建平台、AI PaaS、AI 数字员工平台、企业知识平台、智能客服平台或多智能体协作产品。3. 有零售、供应链或 to B SaaS 行业背景，理解一线业务流程。",
      "salary": "25-50K·13薪",
      "salaryMinK": 25,
      "salaryMaxK": 50,
      "city": "成都",
      "sources": [
        {
          "type": "boss",
          "name": "Boss直聘",
          "url": "https://www.zhipin.com/job_detail/8d26d8a696d50c710nN_29-6GFtV.html"
        }
      ],
      "firstSeenAt": "2026-09-30T07:29:29.606Z",
      "lastSeenAt": "2026-09-30T15:19:26.645Z",
      "status": "active"
    },
    {
      "id": "boss-7b1e2ce8fa3874c8",
      "company": "易诚互动",
      "companySize": "1000-9999人",
      "companySizeMin": 1000,
      "title": "产品经理（成都）",